<?xml version="1.0" encoding="UTF-8" ?>
<aspect name="aspectChangeOrder"
	xsi:schemaLocation="http://www.hyperadapt.net/pxweave/aspects ../../../net.hyperadapt.pxweave/schemas/aspectE2.xsd"
	xmlns:xsi="http://www.w3.org/2001/XMLSchema-instance" xmlns="http://www.hyperadapt.net/pxweave/aspects">
	<interface>
		<core id="core" type="http://books"/>
	</interface>
	<adviceGroup>
		<scope>
			<xpath>/books:bookList</xpath>
		</scope>
		<advices>
			<changeOrder>
				<pointcut>books:book[3]/books:author</pointcut>
				<permutation>(3 1 2)</permutation>
			</changeOrder>
		</advices>
	</adviceGroup>
</aspect>
