<?xml version="1.0" encoding="UTF-8" ?>
<aspect name="aspectDelete"
	xsi:schemaLocation="http://www.hyperadapt.net/pxweave/aspects ../../../net.hyperadapt.pxweave/schemas/aspectE2.xsd"
	xmlns:xsi="http://www.w3.org/2001/XMLSchema-instance" xmlns="http://www.hyperadapt.net/pxweave/aspects">
	<interface>
		<core id="core" type="http://books" />
	</interface>
	<adviceGroup>
		<depends>
			<boolExpr>1+1=2</boolExpr>
		</depends>
		<scope>
			<xpath>/books:bookList</xpath>
		</scope>
		<advices>
			<delete>
				<pointcut>/books:book[position()>1]</pointcut>
			</delete>
		</advices>
	</adviceGroup>
</aspect>
