<?xml version="1.0" encoding="UTF-8" ?>
<aspect name="aspectFillComponentById"
	xsi:schemaLocation="http://www.hyperadapt.net/pxweave/aspects ../../../net.hyperadapt.pxweave/schemas/aspectE2.xsd"
	xmlns:xsi="http://www.w3.org/2001/XMLSchema-instance" xmlns="http://www.hyperadapt.net/pxweave/aspects">
	<interface>
		<core id="core" type="http://booklist" />
		<documentParameters>
			<documentParameter>
				<name>doc</name>
				<uri>../book.xml</uri>
			</documentParameter>
		</documentParameters>
	</interface>
	<adviceGroup>
		<scope>
			<xpath>/bookList</xpath>
		</scope>
		<advices>
			<fillComponentById>
				<pointcut>/book</pointcut>
				<identifyingAttribute>price</identifyingAttribute>
				<source>
					<sourceComponents>$doc//books:book</sourceComponents>
					<identifyingAttribute>price</identifyingAttribute>
				</source>
			</fillComponentById>
		</advices>
	</adviceGroup>
</aspect>
